patient_id,patient_uid,PMID,file_path,title,patient,age,gender,pub_date,label
64040,7049424-1,32148980,oa_comm/PMC007xxxxxx/PMC7049424.xml,"Clarithromycin-Associated Acute Liver Failure Leading to Fatal, Massive Upper Gastrointestinal Hemorrhage from Profound Coagulopathy: Case Report and Systematic Literature Review","A 60-year-old nonalcoholic man with no known liver disease who was chronically administered the following drugs: albuterol and budesonide-formoterol inhalers for asthma; levothyroxine 100 mcg once daily for hypothyroidism; and amlodipine 5 mg once daily, metoprolol 25 mg once daily, and lisinopril 20 mg twice daily for hypertension, presented with atypical chest pain, dyspnea, and productive cough. Physical examination revealed normal vital signs, bilateral wheezing in both lung fields, and no hepatosplenomegaly or stigmata of chronic liver disease. Serial cardiac enzymes and electrocardiograms were within normal limits. Chest roentgenogram revealed no pulmonic consolidation or infiltrates. Laboratory analysis revealed leukocytosis, normal hemoglobin and platelet counts, and normal blood urea nitrogen and creatinine levels. Liver function tests were initially normal, except for an alanine aminotransferase (ALT) level of 72 U/L (, column 2). He was diagnosed with asthma exacerbation secondary to upper respiratory tract infection and treated with clarithromycin 500 mg twice daily orally for 7 days; intravenous corticosteroids, which were subsequently converted to a tapering dose of oral prednisone; and resumption of home medications. He was discharged on hospital day 6 when his symptoms subsided after completing 3 days of clarithromycin therapy.
Ten days after discharge and 6 days after completing a seven-day course of clarithromycin, the patient represented with diffuse abdominal pain for 4 days. Physical examination revealed blood pressure of 147/92 mmHg; otherwise normal vital signs; a soft, distended, diffusely tender abdomen with hypoactive bowel sounds and no rebound tenderness or guarding; and no stigmata of chronic liver disease. There was mild leukocytosis and normal hemoglobin level, while the aminotransferase levels were significantly elevated, and international normalized ratio (INR) was 0.9 (, column 3). The lactic acid was 0.6 mmol/L (normal: 0.5ƒ??2.2 mmol/L), ammonia was 22 ¶æmol/L (normal 11ƒ??35 ¶æmol/L), and acetaminophen level was <4.0 ¶æg/ml. The next day vital signs were stable, with no change in abdominal exam. The AST and ALT levels rose to >1,000 U/L, and lactate dehydrogenase was 4,200 U/L. Extensive tests for viral hepatitis, including anti-HAV, anti-HBs, anti-HBc, HBs antigen, anti-HCV, HCV-RNA, and anti-HEV, were negative, as were tests for human immunodeficiency virus, cytomegalovirus, and Herpes simplex virus. Blood cultures were sterile. The autoimmune hepatitis panel, including anti-nuclear antibody (ANA), anti-mitochondrial antibody (AMA), anti-smooth muscle antibody (ASMA), anti-liver-kidney microsomal (LKM) antibodies, and total immunoglobulin, was negative or within normal limits. Tests for genetic hemochromatosis were negative. Ceruloplasmin level was normal. Slit-lamp ophthalmologic examination did not reveal Kayser-Fleischer rings. Abdominal computerized tomography (CT) with IV contrast and abdominal ultrasound with Doppler studies were unremarkable. Echocardiography was normal.
On day 3, the patient was transferred to an intensive care unit because of altered mental status, asterixis, and ammonia of 96 ¶æmol/L, findings consistent with grade III hepatic encephalopathy. The AST and ALT rose to ƒ?¾6,000 U/L (, column 5), and the hemoglobin declined to 5.5 g/dL, with severe melena from acute upper gastrointestinal bleeding and development of borderline hypotension (Supplementary ). Bleeding was associated with 35,000 platelets/¶æL, prothrombin time >100 seconds, activated partial thromboplastin time >124 seconds, D-dimer >9,999 ng/ml, and fibrinogen <35 mg/dL. Massive blood products were transfused. EGD, planned because of acute melena, and liver biopsy, planned for worsening liver failure, were both postponed due to hemodynamic instability and coagulopathy. Despite aggressive resuscitation, the patient rapidly deteriorated, suffered cardiac arrest, and expired.
The family consented to autopsy confined to liver, kidneys, lungs, and pancreas. Liver postmortem examination grossly revealed a golden-brown soft liver weighing 1,980 gm. Histopathologic hepatic examination revealed massive hepatocyte necrosis, occasional sparing of periportal hepatocytes, and diffuse sinusoidal congestion (Figures and ). No lobular or portal inflammation, fibrosis, viral cytopathic effect, thromboemboli, or malignancy was evident. Immunohistochemistry revealed no Herpes simplex virus types 1 and 2 or cytomegalovirus.","[[60.0, 'year']]",M,2020,liver
64050,7049820-1,32148974,oa_comm/PMC007xxxxxx/PMC7049820.xml,An Uncommon Case of Plasma Cell Mucositis of the Tongue in a Young Man,"We described a case of PCM involving the tongue of a 14-year-old man. The patient was referred to the Oral Pathology Unit at the Faculty of Dentistry, Magna Graecia University of Catanzaro, in August 2019. The referring practitioner suspected squamous cell carcinoma. His past medical history was not relevant, and the patient was a nonsmoker and nonalcohol user. The patient had previously used a nocturnal bite to control bruxism. He reported a burning sensation in his mouth, local dysgeusia, and pain on the tip and on the right lingual border for 1 year. The patient also referred that he was unable to eat or drink any hot or spicy foods due to burning and pain on his tongue. He stated persistent hoarseness, sore throat, and difficulty sleeping due to continuous oral pain.
Extraoral examination was unremarkable, while intraoral examination revealed the presence of an ulcer and intense erythema of the tongue (Figures and ) and gingival edema and erythema (); however, the other parts of the oral mucosa was clinically normal. In the first place, several diagnostic hypotheses were proposed, most of them discarded for incompatibility with full blood count, serum B12 and folate, urea and electrolytes, liver function tests, glucose, anti-nuclear antibody, and syphilis IgG that were normal or negative. The patient underwent an incisional biopsy under local anesthesia. The specimen was stored in a tube containing formalin 10% and sent to a laboratory for histopathological analysis. Microscopically, a large area of ulceration of the coating epithelium subtended by dense plasma cell infiltrate was observed (Figures and ). CD20 and CD3 showed focal positivity for B and T cells, respectively. The plasma cell infiltrate was positive for CD138 (Figures and ) and showed kappa light chain restriction (Figures and ) with a kappa/lambda ratio of 20 : 1 (Figures and ). The final histopathological diagnosis was ƒ??plasmacytosis of the mucous membranes with restriction for the kappa chains.ƒ? Initial pharmacotherapy with prednisone began with 50 mg/day for two weeks, and the patient referred an improvement of his conditions (reduction of pain and swelling). He repeated this treatment one month later, and he experienced a partial regression of the lesions. At 1-year follow-up, there was no regression of the disease and no recurrence of the lesions ().","[[14.0, 'year']]",M,2020,liver
64053,7049895-1,31255515,oa_comm/PMC007xxxxxx/PMC7049895.xml,Transient Neonatal Diabetes: An Etiologic Clue for the Adult Diabetologist,"An asymptomatic 21-year-old Caucasian woman with no history of diabetes was referred by her obstetrician to an adult diabetologist following the birth of her first baby who was macrosomic (birth weight, 5,140 g; birth weight SD score, 3.24); the baby did not have postnatal hypoglycemia. Blood glucose and glycated hemoglobin (A1C) values at different time points are summarized in .
Clinical features at presentation to the diabetes clinic are summarized in . Initial management comprised dietary changes and regular review. She became pregnant 2 years later and was managed with diet. She gave birth to a healthy baby girl, weighing 3,350 g (body weight SD score, ƒ??0.22). On day 6 of life, the baby presented with mild, intermittent hyperglycemia (highest glucose value, 13.1 mmol/L) that did not require glucose-lowering treatment. Genetic analysis revealed that case 1 and her second baby are heterozygous for the ABCC8 missense mutation, p.Arg1183Trp, previously shown to cause TNDM . Postdelivery, case 1 was started on gliclazide 15 mg daily (10% of the standard type 2 diabetes dose) because of rising A1C. Blood glucose monitoring showed fasting hyperglycemia. Her A1C improved from 7.2% (55 mmol/mol) after delivery to 5.9% (41 mmol/mol) at most recent follow up, 6 months after starting gliclazide. She has not reported hypoglycemia, weight gain or other side effects on gliclazide. Capillary glucose testing was not done because she was on oral therapy. The child's diabetes remains in remission needing no treatment, and she is developmentally normal at 4 years of age.","[[21.0, 'year']]",F,3/1/2020,liver
64055,7050116-1,32140078,oa_comm/PMC007xxxxxx/PMC7050116.xml,Multiple trauma including pelvic fracture with multiple arterial embolization: an autopsy case report,"An 83-year-old male cyclist was transported to our hospital 3 h after being struck by a car. He had a medical history of acute coronary syndrome, for which he had received aspirin. His vital signs were as follows: respiratory rate, 22 breaths per minute; oxygen saturation on room air, 96%; systolic blood pressure, 125/67 mmHg; pulse rate, 88 beats per minute; and body temperature, 36.1 ¶øC. On arrival, the patient was diagnosed with multiple trauma including multiple rib fractures with hemothorax, lumbar fractures of the transverse process, and injuries to the right acetabulum, left adrenal gland, left ureter, and liver. His injury severity score was 22. We also found extravasation of the right superior gluteal artery and left adrenal gland. He was treated with a transfusion of red blood cells, plasma, and platelets, and the ratio was 12:26:30. He was administered 1 g tranexamic acid when he presented in this very acute phase. He also required intubation and transcatheter arterial embolization. There was no evidence of stray embolic materials in the external iliac arteries.
Laboratory test findings (normal ranges in parentheses) on hospital day 1 were as follows: white blood cells, 22.08 Ç? 103/×¬L (3.3ƒ??8.6 Ç? 103/×¬L); serum hemoglobin, 11.7 mg/dL (13.7ƒ??16.8 mg/dL); platelets, 136 Ç? 103/×¬L (158ƒ??348 Ç? 103/×¬L); serum creatinine kinase, 554 U/L (59ƒ??248 U/L); partial thromboplastin time, 37 s (25ƒ??38 s); international normalized ratio, 1.31; prothrombin time, 15.8 s (9.8ƒ??12.1 s); serum fibrinogen, 107 mg/dL (200ƒ??400 mg/dL); serum D-dimer, 155.7 ×¬g/mL (< 1.0 ×¬g/mL); and serum fibrinogen degradation products (FDPs), 305.5 ×¬g/mL (< 5.0 ×¬g/mL). Arterial blood gas analysis revealed mixed acidosis with an elevated serum lactate level (FiO2, 0.50; pH, 7.186; pCO2, 49.4 Torr; pO2 89.1 Torr; HCO3, 18 mmol/L; base excess ƒ?? 9.9; and lactate, 44 mg/dL).
On hospital day 2, his serum creatine kinase was markedly elevated to 22,001 U/L. At this point, his right lower leg showed signs of ischemia including lack of a pulse in the right dorsalis pedis artery and cold leg. These findings suggested arterial embolization in the right thigh, and 12 h after the injury, a right above-knee amputation was performed. However, the serum creatine kinase, 44,229 U/L and myoglobin levels, 67,000 ng/mL (< 110 ng/mL), were markedly high, even after the amputation, resulting in acute renal injury, which was treated via hemodiafiltration on hospital day 3. In addition, sustained low efficiency hemodialysis and plasma exchange were performed on hospital day 4. The patientƒ??s creatine kinase and myoglobin levels are plotted against his time course of treatment in Fig. . The changes in hemostatic markers are shown in Table . Despite these treatments, the patientƒ??s hemodynamic status, which included high catecholamine levels, did not improve, and he died on hospital day 8.
We performed an autopsy 50 h after his death. A general postmortem examination revealed pulmonary effusion and alveolar hemorrhage. Liver congestion and fatty liver were observed, as were tubular necrosis and nephrosclerosis in the kidney. There were also signs of arteriosclerosis in the aorta, common iliac arteries, and coronary artery. Necrosis was more severe in the left iliopsoas muscle than in the right. Although there were no signs of initial gastrointestinal tract injuries, irreversible ischemic colitis from the descending colon to the rectum was revealed. In addition, thrombus becoming fibrinized was detected in multiple organs in the autopsy specimen. (Fig. ). This may explain the peritonitis and sepsis, which resulted in continued shock and ultimately death.","[[83.0, 'year']]",M,3/2/2020,liver
64056,7050128-1,32122401,oa_comm/PMC007xxxxxx/PMC7050128.xml,Hoffmannƒ??s syndrome necessitating forearm fasciotomy: a case report,"A 41-year-old Caucasian man presented to hospital with intense pain in his right forearm. The pain exhibited a gradual onset over 2 days, but was abruptly worsened following the simple task of tightening a screw with a screwdriver. His background was from a middle class family with no known risk of hereditary disease. He was in a stable relationship and the father of two children, both in their twenties, from a previous marriage. After completing high school he had earned a university degree in education of children with disabilities, which was also his current profession. His alcohol consumption was moderate and he did not smoke tobacco. Despite his relatively young age, his medical record contained a comprehensive list of previous diseases. At age 25 he underwent fundoplication because of gastric reflux. The procedure was repeated 3 years later due to persisting symptoms. At 29 he was diagnosed as having Hodgkinƒ??s lymphoma. He initially received combination chemotherapy of doxorubicin, bleomycin, vinblastine, and dacarbazine, but this was terminated due to development of leg weakness. To compensate for chemotherapy intolerance, he subsequently received radiotherapy toward lymph nodes in his neck with a total of 40 gray. Consequently, he developed hypothyroidism as a side effect.
He had previously been on thyroid hormone replacement therapy for 7 years. During these years he had been changing the thyroxine medication from synthetic levothyroxine to a preparation derived from porcine thyroid glands, before ending up with a combination of the two. The previous 6 months he had expressed frustration over a general lack of well-being, claiming that the current thyroid hormone replacement therapy did not improve his symptoms. During several visits to his endocrinologist he had communicated a strong desire to discontinue thyroxine hormone replacement therapy completely, in order to see whether it would make him feel better. The idea was supported by his endocrinologist, provided that he, the patient, would be willing to control thyroid function every week, in collaboration with his general physician. In the months leading up to the decision to abandon levothyroxine therapy completely, our patientƒ??s medical record indicated that he was on a natural preparation derived from porcine thyroid glands corresponding to a daily dose of 19 ×¬g of levothyroxine and 4.5 ×¬g of liothyronine in addition to 50 ×¬g of levothyroxine 4 days a week and 25 ×¬g of levothyroxine the remaining 3 days. Approximately 3 months after he had in fact discontinued thyroxine hormone replacement therapy completely, he found himself being examined in the emergency unit because of acute severe pain in his right forearm. At the time of admission, his regular medication included esomeprazole 40 mg twice a day and 100 mg of ferrous sulfate once a day only.
During clinical examination in the emergency unit after midnight, severe pain was located on the dorsal side of his right forearm. His arm appeared swollen on examination, but the overlying skin was completely normal. A brief neurological examination revealed reduced sensibility to sensation on his right forearm compared to his left, especially on the ulnar side. Brachioradial reflexes were normal on both sides, whereas biceps and triceps reflexes were unsuccessfully elicited on either side. Reduced muscular power was described in his fingers and wrist on the right side, but our patient spontaneously disclosed that this was due to the pain being increased during contraction of these muscles. His blood pressure was 165/102 mmHg, pulse 90 beats/minute, respiratory rate 22 per/minute, and rectal temperature 37.0 ¶øC. He did not present any obvious symptoms or clinical signs frequently seen in hypothyroidism, such as lethargy, hair loss, cold intolerance, or myxedema. His creatinine kinase was elevated to 1659 IU/L (range 40ƒ??280). The results of a screening of blood tests including complete blood count, liver function tests, renal function tests, and C-reactive protein were all within the reference range. The resident surgeon ordered overnight elevation of our patientƒ??s arm and opioid analgesics. Despite repeated administration of orally administered analgesics (1 g acetaminophen every 6 hours, 50 mg tramadol hydrochloride once) and intravenously administered opioid analgesics (5 mg oxycodone every 2 hours for 8 hours, followed by 5 mg morphine every 2 hours for 8 hours), he continued to complain of intense pain in his right forearm. The next morning a clinical evaluation of our patient revealed no improvement in pain or edema. His creatinine kinase had increased slightly to 1722 IU/L, and the surgeon on call diagnosed our patient as having compartment syndrome and referred him for immediate surgery. A preoperative computed tomography (CT) scan was performed, which revealed edema in the extensor carpi ulnaris muscle (Fig. ), but no signs of an underlying process such as bleeding, tumor, or abscess. Complementary blood tests revealed a thyroid-stimulating hormone of 30.5 ×¬IU/ml (range 0.2ƒ??4.3) and free thyroxine of 7 ×¬mol/L (range 9ƒ??22), indicating hypothyroidism. A summary of the blood samples and their timing is provided in Table . After induction of general anesthesia by a combination of remifentanil (1 ×¬g/kg per minute), propofol (180 mg), succinylcholine (80 mg) and fentanyl (200 ×¬g), a straightforward fasciotomy was performed. The diagnosis of compartment syndrome was subsequently confirmed by the bulging of the affected muscle following opening of the fascia.
The surgery successfully removed the intense pain of our patientƒ??s forearm. However, a new problem surfaced in the postoperative ward, where he started complaining of similar intense pain in both calves, only a few hours after recovering from the forearm fasciotomy. Upon examination of his legs 3 hours after the forearm fasciotomy had been completed, his calf muscles appeared swollen, but soft and there was no clinical sign of compartment syndrome or myxedema. An ultrasound examination of his lower extremities was performed, but showed open deep veins bilaterally, excluding venous thrombosis as a source of the pain. The pain subsequently increased over the next few hours, but responded to elevation and opioid analgesics (5 mg oxycodone intravenously administered every 2 hours for 6 hours). The next morning, 18 hours after the forearm fasciotomy, the pain in his calves was still present but less severe and thyroid hormone replacement therapy was initiated with a levothyroxine dose of 50 ×¬g a day. Over the next few days the pain in his calves gradually subsided, before disappearing completely on day 3 after the surgery. The edema of his forearm muscle also diminished over the next few days and the skin was closed on day 6 after the fasciotomy.
Our patient was followed regularly by an endocrinologist after he was discharged from hospital. His thyroid function stabilized on a substitution regime of 10 ×¬g of liothyronine a day, in addition to 150 ×¬g of levothyroxine 4 days a week and levothyroxine 125 ×¬g the remaining 3 days of the week. Eight months after discharge he was seen by a neurologist. A full neurological examination only revealed normal findings, specifically demonstrating symmetrical and normal power, and normal sensation and function of his hand and wrist.","[[41.0, 'year']]",M,3/2/2020,liver
249611,11099551-1,37525555,oa_noncomm/PMC011xxxxxx/PMC11099551.xml,Invasive Carcinoma With Skin Adnexal Trichilemmal Hair Follicular Differentiation Occurring in the Breast: A Case Report With Detailed Immunohistochemical and Molecular Analysis,"A 74-year-old female presented with 3 months history of right breast pain. Bilateral diagnostic mammogram showed focal asymmetry measuring 1.5ƒ??cm in the right retroareolar region. Additional imaging by ultrasound revealed a hypoechoic mass measuring 1.1 Ç? 1.0 Ç? 1.0ƒ??cm in the right retroareolar breast, appearing to be contiguous with the nipple. This was reportedly palpable. No dominant mass, distortion, or suspicious calcifications were identified in the left breast. No adenopathy was seen.
Ultrasound-guided biopsy of the mass showed atypical glandular proliferation (). By immunohistochemistry, p63 immunoreactivity highlighted myoepithelial cells surrounding solid nests of atypical cells with a low to intermediate nuclear grade (). Focal and inconspicuous central necrosis was present (). Minute clusters of atypical cells devoid of myoepithelial cells were also identified. However, due to the background dense stroma, definitive characterization was not possible. Smooth muscle myosin (SMMS-1) immunohistochemical stain was negative for myoepithelial cells surrounding these nests, however, the staining pattern was considered to be secondary to attenuation of the myoepithelial cell cytoplasm. In addition, keratin (KRT) 5/6 immunohistochemical stain was diffusely positive throughout the atypical glandular proliferation (). As such, definitive diagnosis was deferred to the excisional specimen.
The patient subsequently had excisional biopsy of the right breast lesion with nipple-areolar complex removal. On gross examination, the nipple was everted and the areola was unremarkable. Serial sections revealed a tan-yellow to white densely fibrotic cut surface with the fibrotic area spanning 6ƒ??cm underlying the nipple. No distinct lesion was readily identified. Microscopic examination showed a well-circumscribed intermediate grade nodular tumor with pushing borders involving the base of the nipple and arrector pili muscle (). Expanded lobules of carcinoma in situ were seen with solid nests of polygonal cells that infiltrated the dermis and the breast emanating from the in situ component (-C). Though inconspicuous, the invasive component which consisted of both squamoid and ductal cell differentiation measured at least 10ƒ??mm. Upon further review, trichilemmal differentiation was identified by the presence of cells with pale to clear cytoplasm surrounded by a palisaded cell layer situated on top of a brightly eosinophilic basement membrane confirming the presence of an in situ adnexal component (). Foci of trichilemmal keratinization were also identified. Lymphovascular space invasion was absent. The tumor approached 2 of the resection margins.
Immunohistochemical analysis was performed, and a summary of the results is shown in . The tumor was positive for markers of basal differentiation including KRT5/6, KRT17, and KRT14. KRT8/18 stained most luminal cells in the in situ component and the central tumor cells in the infiltrating component of the tumor (). CD10 showed focal retained myoepithelial cells in the in situ component (). p63/keratin duo stain highlighted the basal and myoepithelial dual differentiation of tumor cells (). The tumor cells had absent staining for SMMS and calponin. Adipophilin staining pattern was nonspecific. Trichorhinophalangeal syndrome type 1 (TRPS1), mammaglobin, and GATA binding protein 3 (GATA3) were positive while gross cystic disease fluid protein 15 (GCDFP-15) was negative. The tumor was essentially negative for estrogen receptor (>1%), negative for progesterone receptor (0) and negative for Her 2 with a score of 0. Androgen receptor was also negative (0). High-risk and low-risk human papillomavirus (HPV) evaluation by in situ hybridization was negative in the tumor. Molecular testing by next-generation sequencing (Boston Gene tumor portrait) was notable for PTEN gene loss, PIK3CA R1 Q705HfS37 loss of function variant allele frequency (VAF 18.7%), CDKN2A/B loss, and human leukocyte antigen (HLA) class I loss of heterozygosity with a tumor mutation burden of 0.59mut/Mb. Tumor origin was reported as most likely breast cancer with a prediction probability of 100%. The prediction probability was 93.2% for basal breast cancer and 63.5% for nonbasal breast cancer. However, the gene portrait could not differentiate basal breast cancer from cutaneous adnexal carcinoma.
As the tumor was likely to behave like specialized triple negative adnexal/salivary gland type carcinomas in the breast, a re-excision and sentinel lymph node biopsy was performed. Additional excision showed residual in situ and invasive carcinoma with histological features identical to the infiltrating component of the primary tumor. The invasive carcinoma was >2ƒ??mm from the new margin. Rare isolated tumor cells, which may have been introduced by the prior biopsy procedure, were identified in the right axillary sentinel lymph node. The patient subsequently received adjuvant radiation therapy and is currently doing well.","[[74.0, 'year']]",F,7/31/2023,cervical
