patient_id,patient_uid,PMID,file_path,title,patient,age,gender,pub_date,label
249627,11100486-1,38765866,oa_noncomm/PMC011xxxxxx/PMC11100486.xml,Clinical Efficacy of Percutaneous Osteoplasty Under Fluoroscopy and Cone-Beam CT Guidance for Painful Sternal Metastases: A Case Series,"A 71-year-old man complained of persistent pain of anterior chest wall and braced himself, when coughing. Upon examination, there was pinpoint tenderness over the sternum. On CT scan, there was a lesion measured 5.4 Ç? 4.7 Ç? 3.9 cm in left lung hilum, and an osteolytic destructive lesion was located at the sternal manubrium. The lesion of the sternum was approximately 2.5 Ç? 4.1 Ç? 2.4 cm in size and was surrounded by partially destroyed anterior and posterior cortical bone. The biopsy of lung lesion confirmed squamous cell carcinoma. The patient had a numerical rating scale (NRS) of 9, and no symptom improvement was obtained with oral narcotic. POP was performed with two puncture the lesion sites. Two needles were inserted into the lesion successively at a 45¶ø inclination using an inferior to superior approach, and 2.5 mL of cement was injected into the sternal lesion. The immediate post-procedure CT scan demonstrated a good distribution of the cement in the lesion and only a slight leakage along the posterior cortical margin (). After the procedure, the patient gained a significant pain relief, and the NRS scores were decreased to 4, 3, 3, and 3, at the 1-week, 1-month, 3-month, and 6-month follow-up, respectively. No complication occurred.","[[71.0, 'year']]",M,5/13/2024,cervical
249634,11100632-1,38764927,oa_noncomm/PMC011xxxxxx/PMC11100632.xml,Russell Body Cervicitis in a Human Immunodeficiency Virus-positive Female: An Unusual Presentation of Prolonged Cervical Inflammation,"A 34-year-old female, P2 L2 with last childbirth 8 years back visited the gynecology outpatient department with complaints of copious vaginal discharge from the last 1 year. The discharge was yellowish in color, nonfoul smelling, watery in consistency, and present all through the menstrual cycle. There was no history of itching in the perineal region, menstrual irregularity, dysuria, or dyspareunia. There was no history of pain lower abdomen or any bladder or bowel complaints. Her past history was significant in that she was HIV positive, acquired through a blood transfusion, and she had been on a combination of zidovudine, lamivudine, and nevirapine for the last 5 years. Her last CD-4 cell count was cell 534/×¬L. She was in chronic stage of HIV and has severe anemia (hemoglobin ƒ?? 6.5 g/dl) with reactive thrombocytosis (platelet count: 6.64 lakh/ml). The patient also had multinodular goiter with Hashimoto thyroiditis. Antithyroid peroxidase antibody titer was 135 IU/ml and anti-thyroglobulin antibody was 62.6 IU/ml. There was no history of hypertension, diabetes mellitus, tuberculosis, or any other chronic medical disease.
On examination, her general condition was unremarkable, except for mild pallor. On local examination, the external genitalia were normal. On per speculum examination, the cervix looked hypertrophied with perioral erosion, and nabothian cyst, about 1 cm Ç? 1 cm at 11 oƒ?? clock position. Bleeding on contact was present. On application of acetic acid, there was thin acetowhite epithelium with irregular and geographical borders, with fine punctations (Grade 1 changes, as per 2011 IFCPC Nomenclature). The squamousƒ??columnar junction was fully visible and located on the ectocervix (Type I TZ) []. On bimanual examination, the uterus was noted to be of normal size, with no abnormality palpable in either adnexa. The Pap smear was suggestive of a high-grade squamous intraepithelial lesion. Human papillomavirus DNA was negative. Ultrasound examination was suggestive of a bulky uterus (10.3 cm Ç? 5.4 cm) with ill-defined endometrial echoes. Cervical and endometrial biopsy was done. Histological examination showed a polypoidal configuration of the surface epithelium with intense plasma cell-rich inflammation in the subepithelial stroma. Many of the plasma cells show intense eosinophilic intracytoplasmic inclusion, causing peripheral displacement of the nucleus, termed Russell bodies. There is no evidence of dysplasia in the cervical lining epithelium, and could not detect any causative organism on hematoxylin sections and special stains [].","[[34.0, 'year']]",F,2024,cervical
249635,11100634-1,38764926,oa_noncomm/PMC011xxxxxx/PMC11100634.xml,BOTRROID Embryonal Rhabdomyosarcoma with Uterine Cervix in a Postmenopausal Woman: An Unusual Case Report,"A 50-year-old menopause woman who had been vaginal discharge and bleeding for about 2 years without dysuria, dyspareunia, or postcuital bleeding was informed consent for presenting. In the cervical examination, there was a polyp, which was biopsied. The Ethical Committee of Qom University of Medical Sciences approved the ethical consideration of this case by IR.MUQ.REC.1402.083 code at 22 Jul, 2023.
The pathology result showed an endocervical polyp with ulceration and inflammation and negative for dysplasia or malignancy and polypectomy.
The dimensions of the uterus were 62 mm Ç? 25 mm Ç? 32 mm in sonography and the ovaries were normal. The heteroechoic mass 45 Ç? 25 Ç? 20 contained vessels that filled the cervical canal and extended to the upper part of the vaginal canal. There was no evidence of the extension of this mass to the uterine cavity.
Abdominopelvic magnetic resonance imaging (MRI) reported that there was a 78 mm Ç? 68 mm Ç? 70 mm mass in the cervix. It showed a heterogeneous increased signal on T2-weighted image and heterogenic enhancing cystic, necrotize components. The post GD images extension into the proximal portion of vagina shows well defined T2 hypointense rim with bulge toward the parametrium and suspicion of parametrial invasion. The mass contained well-defined border with the uterus. However, mild widening of the endometrial cavity at the body of the uterus is visible with a maximum anteroposterior diameter of about 10 mm. Both ovaries were atrophic and no adnexal mass was seen. Large well defined heterogeneously enhancing mass at the uterine cervix is related to a carcinosarcoma with mild extension to the proximal endovaginal canal, and suspicion of early evidence of parametrial invasion []. The patient underwent curettage again; the result of endometrial curettage after 6 months was a fragment of endocervical polyps with chondroid metaplasia. Therefore, cervix adenosarcoma with heterologous elements chondroid differential diagnosis was done. The histological grade was low grade [].
The immunohistochemistry (IHC) was done and its results showed [] positive desmin, Myo D1, and cytoplasmic staining WT 1 and negative smooth muscle actin (SMA) with a diagnosis of ERMS (BOTRROID type) of the uterine cervix. IHC was positive results in CK, CYCLIN, DESIM, and PAX8 and negative in C-KIT, SMA, GATA-3, CD10, NAPSIN-A, and ER factors. Carcinoma with heterologous component ERMS was our final diagnosis []. The patient underwent four sessions of neoadjuvant chemotherapy with AIM, doxorubicin, ifosfamide, and mesna []. Then, the patient underwent surgery, so radical hysterectomy, salpingo-oophorectomy, lymphadenectomy, and omentum biopsy were done on June 2021. After the surgery, two sessions of brachytherapy with intracavitary technique and 28 sessions of radiotherapy with ISO gray system and conformal technique with 5040CGY were done. Furthermore, one session of adjuvant chemotherapy was done.
The pathological result after the surgery showed embryonic RMS with heterologous element []. Tumor size was at largest dimension of 5 cm with an additional dimension of 3.5 cm Ç? 3 cm. The tumor site was endocervix with extension to exocervix. Cervical stromal involvement was more than 50% of cervical thickness. No lymph node vascular invasion was seen. Endometrium showed cystic atrophy and myometrium had no specific pathological change. Omentum was mature adipose tissue with free from involvement that observed in the left and right obturator lymph node dissection.
MRI was conducted on March 2022 for comparison with previous MRI with and without contrast and showed salpingohysterectomy and bilateral oophorectomy with no evidence of residual tumor at the surgical site and a small amount of free fluid in the pelvic. No significant pelvic lymph node was seen. A small amount of free fluid was noted in the pelvic cavity. Uniform wall thickening was notable in the rectum, which is probably due to the past radiotherapy changes.
The patientƒ??s follow-up with physical examination and imaging review during 2 years showed no evidence of progression or recurrence.","[[50.0, 'year']]",F,2024,cervical
249697,11107908-1,38774152,oa_noncomm/PMC011xxxxxx/PMC11107908.xml,A Case Report of Pregnancy Complicated with Primary Hemophagocytic Lymphohistiocytosis,"A 35-year-old primiparous woman was admitted to the hospital at 29 weeks gestation, with a history of abdominal pain for 2 hours, and vaginal discharge for 1 hour. She had regular prenatal check-ups during pregnancy, with a diagnosis of gestational diabetes and G-6-PD deficiency. The patient had no history of chronic diseases such as hypertension, diabetes, or hepatitis before pregnancy and denied any family history of hereditary diseases. Before admission, her serum ferritin level was measured at 1910.84 ng/mL by routinely prenatal test. Upon admission, the patientƒ??s vital signs were recorded as follows: Temperature (T) - 36.4¶øC, Pulse rate (P) - 92 beats/minute, Respiratory rate (R) - 20 breaths/minute, Blood Pressure (BP) - 130/74 mmHg. No palpable enlargement of superficial lymph nodes was detected. On pelvic examination, the cervix was fully dilated at 10 cm, the amniotic membrane had ruptured, and the fetal presented as cephalic with a station of 2cm below the ischiatic spine. Laboratory tests showed a white blood cell count (WBC) of 8.69Ç?109/L, hemoglobin (HGB) of 102 g/L, platelet count (PLT) of 259Ç?109/L, alanine aminotransferase (ALT) of 50 U/L, aspartate aminotransferase (AST) of 101 U/L, and fibrinogen (FIB) of 4.94 g/L. Following admission, dexamethasone was given via intramuscular injection to promote fetal lung maturation and cefazolin sodium pentahydrate was administrated for anti-infective treatment. The patient delivered a baby girl weighing 1300 g, with Apgar scores of 8-9-9. However, several hours later, the patient started experiencing recurrent chills and fever, with a maximum temperature of 40.0¶øC. Although we upgraded antibiotics to strengthen anti-infection and antiviral treatment, the patient continued to have a fever for 8 days. The patient had no other clinical manifestations of systemic infection except for fever. Due to the unclear cause of the fever, a multidisciplinary team (MDT) composed of experts in obstetrics, hematology, rheumatology, respiratory medicine, endocrinology, critical care medicine, and genetic and genomic medicine was consulted to analyze the patientƒ??s condition. Improved examinations were provided based on the MDT consultation (). With recurrent fever (temperature ƒ?¾38.5¶øC for over 7 days), leukopenia, decreased hemoglobin, elevated triglycerides, decreased fibrinogen, elevated ferritin, decreased NK cell count, and reduced NK cell activity, along with increased soluble CD25 levels, and NK cell CD107a degranulation assay suggesting impaired NK cell function (), a diagnosis of HLH was considered. Accordingly, the patient was admitted to Hematology Department for bone marrow aspiration and biopsy. The examination revealed the tissue hemophagocytosis (). The patient had elevated levels of sCD25 (2170.72 U/mL), and the NK cell CD107a degranulation assay showed functional impairment of NK cell degranulation, which supported the diagnosis of HLH. Two days after MDT consultation, the patient received dexamethasone (16 mg, once daily), and then twenty-four hours later, the patientƒ??s temperature returned to normal. The dose of dexamethasone was adjusted according to the patientƒ??s condition (). At the same time of treatment, the etiology of the patientƒ??s HLH was examined. The pathogen screening tests showed that influenza A and B viruses, human parvovirus DNA (B19-DNA), CMV-DNA, and EBV-DNA were negative, so viral infection was not supported; fungal ×ý-D glucan assay (G test), GM test and fungal culture showed no abnormality, hence no obvious fungal infection; Autoantibody spectrum (including ANA, anti-dsDNA, ACA, nRNP/Sm, Sm, SSA, R0-52, SSB, ScI-70, Jo-1, CENP) B, anti-dsDNA, Nucleosome, Histone, Rib.P-Prot.pANCA, cANCA, MPO-ANCA, PR3-ANCA, etc.), complement C3 and C4, immunoglobulin G4 was not abnormal. In addition, tumor markers and superficial lymph node ultrasound showed no significant abnormalities. Positron emission tomography and computed tomography (PET/CT) indicated diffuse inflammatory lesions in the liver, while liver biopsy suggested non-alcoholic fatty liver disease (NAFLD). Exome sequencing showed NM_199242.3 (UNC13D): c.1280G >A p.(Arg427Gln), suggesting heterozygous variation in UNC13D gene (). This patient was considered for possible concomitant pHLH. Therefore, a complete exome sequencing in the patientƒ??s family members was suggested, which was rejected by the patient and her family. After discharge, the patient continued to receive oral dexamethasone hormone therapy and gradually tapered off the medication on a weekly basis, with follow-ups showing good recovery and no relapse.","[[35.0, 'year']]",F,5/17/2024,cervical
249722,11110504-1,38778909,oa_noncomm/PMC011xxxxxx/PMC11110504.xml,Imaging of an exceptional urinoma complicating a cervical cancer and leading to death: A case report,"A 66-year-old female with no medical history presented to gynecological consultation with isolated uterine bleeding for 6 months. The clinical examination revealed a tumor of the cervix, which was confirmed by biopsy to be a well-differentiated squamous cell carcinoma. A thoraco-abdomino-pelvic CT scan was performed as a part of an extension assessment and showed a huge retroperitoneal right-sided abdominal-pelvic cystic mass exercising a mass effect on the homolateral kidney against the anterior abdominal wall. The mass had well-defined, regular contours with a thin wall and a dense fluid content with multiple thin septa that enhanced faintly after injection of contrast medium (). Delayed acquisitions performed at 15 min and 2 h after revealed a slow, progressive, and partial filling of the mass by the contrast medium (). Ultrasonography showed an anechogenic cystic mass containing multiple fine septa with a fishnet-like appearance (), indicating chronicity of the urinoma and the origin of its partial, heterogeneous filling. In addition, there was bilateral ureterohydronephrosis with a 17 mm pylon on the left side of the cervical tumor and a 51 mm pylon on the contralateral side, explaining the delayed excretion. Upon discovery of this mass, the patient was urgently referred for a urological consultation. A blood test was performed and showed elevated levels of uremia and creatinemia with an estimated glomerular rate of 11 ml/min associated with mild hyperkalemia without electrical changes and leukocytosis. The case was discussed in a multidisciplinary consultation, and percutaneous nephrostomy was considered. However, the patient began to suffer from uremic encephalopathy, requiring intensive care unit, where she died despite efforts to restore proper renal function and treat her sepsis.","[[66.0, 'year']]",F,5/21/2024,cervical
249723,11110509-1,38778911,oa_noncomm/PMC011xxxxxx/PMC11110509.xml,Basal cell carcinomas of the areola-nipple complex: Case report and review of the literature,"We report the case of a 47-year-old, smoker female patient with a medical history of hypertension, type 2 diabetes, and untreated psychosis. The patient had a family history of breast cancer in her aunt. She presented with a non-regressing ulceration on the right areolar region of the breast, without nipple involvement, which had been present for about 10 years and had progressively extended over time. The lesion had several episodes of infection, becoming inflamed, purulent, and bleeding with irritation of the peri-lesional skin, which prompted the patient to seek medical attention. Dermatological examination revealed a well-defined irregularly shaped ulceration, roughly oval, with a budding surface in some areas and fibrino-purulent surface in others, sharp-edged borders, and a surrounding erythematous-violaceous rim. The lesion measured 15 cm in the longest axis. The peri-lesional skin was erythematous, infiltrated, erosive in some areas, and dotted with pustules in others.
Breast tumor origin was ruled out after ultrasound and mammography examinations. Clinical suspicion was focused on Pagetƒ??s disease, infiltrating BCC, ulcerated pigmented squamous cell carcinoma, or porocarcinoma. A biopsy of the ulcer margins was performed, and histopathological analysis showed a well-demarcated proliferation of tumor lobules with large cells having abundant basophilic cytoplasm and moderately atypical nuclei arranged in a palisading pattern at the periphery. Retraction clefts were observed between the lobules and the adjacent tumor stroma (). Immunohistochemical analysis revealed strong and diffuse expression of GATA3, CK5/6, and P63 (), with no expression of epithelial menmbrane antigen (EMA), hormone receptors, CK7, CK19, mammaglobin, GCDFP-15, or HER2, leading to a diagnosis of BCC of the areolar plate.
Upon thorough clinical examination and comprehensive imaging studies, there was an absence of axillary lymph node (LN) involvement noted in the patient.
Following the planned surgical intervention for local tumor excision, the patient underwent regular postoperative follow-up appointments, including scanner checks to monitor for any signs of recurrence or complications. Throughout the follow-up period, no recurrence or adverse events were observed, indicating a favorable post-therapeutic course.","[[47.0, 'year']]",F,5/21/2024,cervical
249764,11113021-1,38784245,oa_noncomm/PMC011xxxxxx/PMC11113021.xml,Surgical management of a huge oral verrucous carcinoma: A case report and review of the literature,"A 43-year-old female reported to the oral and maxillofacial surgery clinic of our institution in January 2023 because of a painless, slow-growing ulcerated mass on her chin for 3 years. It started as a small nodule on the chin, progressively increasing in size over time. Later, the nodule ruptured to form an open ulcer. No relieving or aggravating factors were reported, and the lesion was associated with mild discomfort during eating. The patient denied a history of trauma. She was an alcohol consumer but a nonsmoker with a healthy general condition. On examination, there was no facial asymmetry, and lymph nodes were not enlarged. Speaking and swallowing remained undisturbed. Intra-orally, the presence of an ulcer on the lower border of the mandible in the region of the chin and submandibular area with an uneven surface was noted. Extraorally, the lesion was fungating, whitish-pink with a cauliflower shape, measuring 8 Ç? 6 cm on its greatest dimension. The lesion was locally destructive, predominantly localized extraorally in the submandibular region ( and ()). A clinical diagnosis of oral VC was entertained, with differential diagnoses of giant condyloma, warts, pseudoepitheliomatous epidermal hyperplasia, keratoacanthoma, and squamous cell carcinoma.
Histopathology of an incisional biopsy demonstrated a verrucous lesion consisting of well-differentiated squamous cell proliferation with exophytic and endophytic components. The tumor displayed blunt projections with bulbous processes and pushing margins. Individual cells had minimal nuclear atypia (). The findings were in keeping with oral VC, with differential diagnoses of kerathoacanthoma and well-differentiated squamous cell carcinoma. An orthopantomogram (OPG) () and chest x-ray were normal. The patient was counseled for wide-ranging local excisional surgery. The procedure was scheduled after obtaining her authorization.
The surgical procedure was performed under general anesthesia. Under aseptic conditions, a wide local tumor excision was performed (). The tumor removal was approached extraorally with at least 1 cm of free surgical margins. The surgical wound was primarily closed with the advancement of nearby muscles and skin in layers in a watertight fashion (). The patientƒ??s postoperative course was uneventful. The excised lesion was sent for histopathological examination. The final diagnosis report was similar to the previous incisional biopsy, with free surgical margins. To date, the patient remains symptom-free. No recurrence has been observed after a follow-up of almost 12 months ().","[[43.0, 'year']]",F,5/22/2024,cervical
249770,11113062-1,38784243,oa_noncomm/PMC011xxxxxx/PMC11113062.xml,A rare case of obstructed hemivagina with uterus didelphys and ipsilateral renal anomaly syndrome,"A 13-year-old female patient presented with recurrent lower abdominal pain that evolved into persistent discomfort radiating to the right thigh over a 9-month duration, accompanied by nausea and vomiting. Menarche occurred 2 years prior, and the patient reported irregular menstrual cycles, occurring every 2ƒ??3 months with a duration of 3ƒ??5 days. Physical examination revealed tenderness in the lower abdomen and the identification of a palpable pelvic mass on the right side, while the external genitalia appeared normal. The abdominal and pelvic ultrasound revealed right renal agenesis and a left-sided uterus measuring 3 Ç? 2.5 Ç? 5 cm. The uterus exhibited a normal three-line endometrium and cervix, alongside bilateral ovaries showing multiple small follicle cystic lesions. In addition, an oval-shaped mass measuring 10 Ç? 7.5 Ç?5 cm was identified in the right intraabdominal region. The mass had a 1 cm thick wall containing material resembling ground glass. The decision to omit trans-vaginal ultrasound was made due to cultural considerations and the need to preserve the hymen.
Subsequently, a computerized tomography (CT) scan was done and revealed right kidney agenesis and a compensatory enlarged left kidney measuring about 13 cm (). The imaging also indicated features suggestive of uterus didelphys coupled with unilateral (right) obstructed hemivagina and hematometrocolpos, prompting suspicion of OHVIRA syndrome. Magnetic resonance imaging (MRI) was subsequently employed to confirm the diagnosis ().
Under general anesthesia, a perineal examination, conducted gently with the aid of two small sinus retractors, unveiled a high, thick transverse septum located just below the cervix. A low transverse abdominal incision was made, which identified the 10 Ç? 7 cm right enlarged uterus filled with chocolate-like material. Aspiration of the blood was performed, followed by a hysterectomy, while the vaginal septum was intentionally preserved in situ. Finally, closure of the vaginal pouch was accomplished by suturing with the peritoneum to prevent herniation. On the third postoperative day, the patient was discharged in a healthy, pain-free condition. At the 1-month follow-up in the outpatient clinic, the patient remained asymptomatic, reporting no pain or concerns, and the incision site exhibited satisfactory healing.","[[13.0, 'year']]",F,5/22/2024,cervical
249786,11116291-2,38722558,oa_noncomm/PMC011xxxxxx/PMC11116291.xml,Cutaneous Superficial Basal Cell Carcinoma is a Basal Cell Carcinoma In Situ: Electron Microscopy of a Case Series of Basal Cell Carcinomas,Case 2ƒ??A 58-year-old woman presented with flesh-colored papule on her clavicle. She also has a history of squamous cell carcinoma of scalp that was excised a year ago. A shave biopsy from current lesion was taken for examination. Light microscopy showed tumor nodules deep in the dermis that are not contiguous with epidermis (Fig. ).,"[[58.0, 'year']]",F,5/9/2024,cervical
