patient_id,patient_uid,PMID,file_path,title,patient,age,gender,pub_date,label
0,497050-1,15268761,oa_comm/PMC000xxxxxx/PMC497050.xml,Echocardiographic assessment and percutaneous closure of multiple atrial septal defects,"A 34-year old woman was referred for consideration of percutaneous ASD closure. The ASD had been diagnosed when the patient was 12 years old and TTE had suggested that the right ventricle was dilating. At cardiac catheterisation there were mildly elevated right ventricular systolic pressures and a pulmonary to systemic flow ratio of over two. The secundum ASD was estimated to be 15 mm wide using TTE with aneurysmal formation of the interatrial septum. The patient was admitted for percutaneous ASD closure and underwent uncomplicated placement of a 17 mm Amplatzer septal occluder. Transesophageal echocardiography (TEE) during the procedure revealed the presence of a second ASD near the inferior vena cava and a small post-procedure shunt. The septal occluder did not completely cover both defects. Equivalent chest x-ray radiation dose (assuming a single posteroanterior projection chest x-ray is eight centi-Gray/cm2) was 400. Repeat TTE continued to demonstrate left to right shunting and the patient was readmitted for a further device closure six months later. At cardiac catheterisation, the second defect was identified low in the secundum septum between the fossa ovalis and the mouth of the coronary sinus. The defect was successfully closed with a 9 mm Amplatzer septal occluder with no evidence of obstructed flow in either the coronary sinus or the inferior vena cava. Equivalent chest x-ray radiation dose for the second procedure was 187. The patient remained well with no evidence of residual shunt six months following the procedure.","[[34.0, 'year']]",F,2004,heart
1,497050-2,15268761,oa_comm/PMC000xxxxxx/PMC497050.xml,Echocardiographic assessment and percutaneous closure of multiple atrial septal defects,"A 31-year old woman was found to have a secundum ASD during investigations for breathlessness. The defect was estimated to be 10 mm wide on TTE with evidence of right atrial and right ventricular dilatation. Left atrial size was normal. She was referred was further investigation and treatment. Cardiac catheterisation demonstrated a pulmonary to systemic flow shunt of four to one. Peri-procedure TEE revealed that there were two defects; one measuring 24 mm located inferiorly between the inferior vena cava and coronary sinus os with the second defect situated superiorly and measuring 30 mm. The inferior defect was closed using a 24 mm Amplatzer septal occluder. Equivalent chest x-ray radiation dose was 403. The patient was discharged the following day and readmitted three months later for closure of the superior defect. This was performed using a 30 mm Amplatzer septal occluder. The procedure was technical difficult as after deployment of the left sided disc, the device initially lay obliquely in the defect. The final position was satisfactory with no evidence of intra-cardiac shunting (figure ). There was no interference between the two devices and mitral valve function remained normal. Equivalent chest x-ray radiation dose for the second procedure was 727. The patient remained well and at six month follow-up there was no evidence of residual shunt.","[[31.0, 'year']]",F,2004,heart
2,497050-3,15268761,oa_comm/PMC000xxxxxx/PMC497050.xml,Echocardiographic assessment and percutaneous closure of multiple atrial septal defects,"A 30-year old woman was investigated for palpitations and a secundum ASD of approximately 20 mm was diagnosed. TEE suggested that the atrial septum was fenestrated with a small inferior rim of tissue and she was referred for device closure. At cardiac catheterisation it became clear that there were two principal defects, one in the fossa ovalis and the other situated inferior and posterior between the fossa ovalis and the coronary sinus. The superior hole was closed with a 16 mm Amplatzer septal occluder but failed to cover the inferior defect. A 15 mm Amplatzer septal occluder device was subsequently placed successfully across the inferior defect with a stable position (figure ). Equivalent chest x-ray radiation dose for the procedure was 124. Subsequent follow-up revealed a small left to right shunt between the two septal occluders but further intervention was not considered necessary.","[[30.0, 'year']]",F,2004,heart
8,514549-2,15298718,oa_comm/PMC000xxxxxx/PMC514549.xml,Misoprostol for treating postpartum haemorrhage: a randomized controlled trial [ISRCTN72263357],"A 32-year-old woman, para 2, gravida 4, delivered normally after labour was induced with misoprostol, 25 ×¬g vaginally and 4 doses of 50 ×¬g orally. Before enrolment she received oxytocin10 units, ergometrine 0.5 mg and a 20-unit oxytocin infusion. She was enrolled and received the trial medication 140 minutes after delivery. After enrolment she received a further 40-unit oxytocin infusion. Measured blood loss in the hour after enrolment was 380 ml. Bleeding continued and a blood transfusion was commenced. Six and a half hours after delivery she suffered a cardiac arrest and was resuscitated. Examination in theatre found the uterus to be empty and intact. The main source of bleeding appeared to be a torn cervix, which was sutured. At 7.5 hours after delivery she suffered a second cardiac arrest and could not be resuscitated. The estimated total blood loss was 3,000 ml.","[[32.0, 'year']]",F,2004,heart
9,514562-1,15301690,oa_comm/PMC000xxxxxx/PMC514562.xml,Intrathecal baclofen withdrawal syndrome- a life-threatening complication of baclofen pump: A case report,"A 24-year-old man was admitted to our intensive care unit (ICU) with a possible diagnosis of seizure disorder and sepsis. He had a past medical history of cerebral palsy and spastic quadriparesis. Three years ago, he had an ITB pump implanted for spasticity refractory to the high doses of oral baclofen. He had a significant improvement in spasticity, social and functional capacity in the past three years.
Later, he developed some disorientation and increased spasticity. He was taken to a local physician who prescribed oral baclofen (120 mg daily in four divided doses) for his increased spasticity. He also advised him to have his ITB pump checked immediately. The following day, his spasticity increased even after taking oral baclofen. He developed multiple seizures and respiratory distress in the next 24-hour period. Subsequently, he was admitted in a local hospital where he was orally intubated and transferred to our ICU for aggressive management.
On presentation, his temperature was 104.6¶øF (40.3¶øC), heart rate 127 beats per minute, and the blood pressure was 85/45 mm/Hg. His ventilator settings were: assist-control ventilation mode; respiratory rate, 15 breaths per minute; tidal volume, 650 mL; positive end expiratory pressure (PEEP), 5 cm H2O; and FiO2, 60%. His spontaneous respiratory rate was 18 breaths per minute and an oxygen saturation of 100% was noted on pulse oximetry. In the local hospital, he was documented to have a high fever of 107¶øF (41.6¶øC) and he had received intravenous lorazepam, phenytoin, pantoprazole, piperacillin/tazobactem and dopamine. On physical examination, neurologically he was unconscious with decerebrate posturing and his Glasgow coma scale was 6. He had an absent corneal and gag reflexes. He was moving all four limbs in response to noxious stimuli. He was also noted to have an extreme spasticity in all four limbs. Lung examination revealed decreased breath sounds in the left lower base. Cardiac examination was unremarkable. He had a palpable baclofen pump on abdominal wall and bowel sounds were heard. The differential diagnoses were septic shock, meningitis, neuroleptic malignant syndrome and malignant hyperthermia.
The initial laboratory results showed serum creatinine phosphokinase (CPK) 5250 U/L (Normal, 25ƒ??235 U/L) and CPK-MB fraction 12.1 ng/ml (Normal, 0.5ƒ??6.3 U/L). Serum chemistry revealed sodium 142 mmol/L, potassium 5.1 mmol/L, chloride 120 mmol/L, bicarbonate 13 mmol/L, and creatinine 2.1 mg/dl. Hemogram showed white blood cell count 12.2 K/UL, hemoglobin 16.5 g/dl and platelet count 9 K/UL (Normal, 130ƒ??400 K/UL). Liver function test showed aspartate aminotransferase (ALT) 1128 U/L, alanine aminotransferase (AST) 1140 U/L, alkaline phophatase 90 U/L, total bilirubin 1.2 mg/dl, conjugated bilirubin 0.7 mg/dl, prothrombin time 20.2 seconds (Normal, 10ƒ??12.5 seconds), and INR 2.0 (Normal, 0.9ƒ??1.1). Blood and urine cultures were obtained. Chest radiograph was normal. A computed tomography (CT) scan of the chest revealed atelectasis of the left lung base. His CT scan of head did not show any acute infarct or bleeding. His initial management included intravenous fluids, norepinephrine, platelet transfusion, phenytoin, propofol and broad-spectrum antibiotics (vancomycin, ceftriaxone) for suspected meningitis and septic shock. He received intravenous lorazepam (4ƒ??8 mg every four hours) for his spasticity. Next day, his spasticity improved and an ITB specialist investigated his baclofen pump. His baclofen pump analysis revealed that it was stopped due to some programming error, which was restarted at a previously prescribed baclofen rate (260 ×¬g/day).
On third hospital day, his serum CPK was 15,878 U/L, AST was 2566 U/L, ALT was 2993 U/L, while CPK-MB fraction came down to 3.4 ng/ml. His urine output decreased (<400 ml/ day) and serum creatinine increased in the range of 5ƒ??6 mg/dl. Later, he was hemodialyzed few times during the course of hospitalization due to acute renal failure. His echocardiogram showed left ventricular ejection fraction of 20ƒ??25% and severe global hypokinesis. His electroencephalogram did not reveal any epileptogenic activity. He developed full-blown multisystem organ failure with an evidence of shock liver, renal failure, respiratory failure, disseminated intravascular coagulation and myocardial depression. His nutrition was started on nasogastric tube feedings, and proper ventilator care was taken through a tracheostomy tube. His serum baclofen obtained at the time of admission was less than 0.02 ×¬g/ml (Expected values, 0.08ƒ??0.4 ×¬g/ml). After a three-week course of aggressive management in ICU, he was weaned off from the ventilator and his multiple organ shock resolved. At a six-month follow-up, he was observed in a nursing home with his baseline functional, social, and family activities.","[[24.0, 'year']]",M,2004,heart
11,514718-1,15310408,oa_comm/PMC000xxxxxx/PMC514718.xml,Atypical vessels as an early sign of intracardiac myxoma?,"A 62-year-old woman with known metabolic syndrome was referred to our clinic to exclude coronary artery disease invasively. She has been experiencing chest pain for four months which has not increased in frequency or duration since it started. She denied pain at rest, nocturnal pain, difficulty breathing, or palpitations. An echocardiographic stress examination revealed significant ischemia with anteroseptal hypokinesia. Cardiac chambers were morphologically normal. The ""baseline"" echocardiography and stress echo was unsuspicious of a left atrial myxoma (Fig. ).
Coronary angiography revealed coronary artery disease with a stenosis of the proximal left anterior descending coronary artery (LAD) near the left main stem. A stent was implanted in the proximal LAD with no residual stenosis. The ventricle was morphologically normal.
A coronary angiography performed 13 months after stent implantation showed no re-stenosis and a normal left ventricle. No echocardiogram was performed at this time 32 months after the control coronary angiography, the patient was readmitted because of increasing dyspnoea and palpitations. A transthoracic echocardiography disclosed a big (70 Ç? 30 mm) mass in the left atrium attached to the interatrial septum. The tumor prolapsed into the left ventricle obstructing the mitral valve orifice (Fig ). The mean pressure gradient across the mitral valve was 8 mm Hg.
A subsequent coronary angiography and LV and RV catheterization detected a mean diastolic pressure gradient of 12 mm Hg between the pulmonary capillary wedge and the left ventricular enddiastolic pressure, and no re-stenosis of the LAD stent. The angiography was notable for a large area with small atypical, tortuous vessels in the region of the interatrial septum. These vessels were shown to originate from branches of the right coronary artery (RCA) and the circumflex coronary artery (RCX). (Fig. )
Surgery was promptly performed and the tumor was successfully excised. Histology confirmed the diagnosis of a cardiac myxoma.
A retrospective analysis of the initial coronary angiographies (baseline, 13 and 45 months) disclosed the atypical vessels in a small area of interatrial septum (Fig. , , ).","[[62.0, 'year']]",F,2004,heart
12,514721-1,15306032,oa_comm/PMC000xxxxxx/PMC514721.xml,HÇ¬rthle cell carcinoma: diagnostic and therapeutic implications,"A 79-year-old male was referred in March 2003 with a lump on the left side of his neck. The patient had noted a sudden increase in the size of the lump over the preceding two months. He did not report any neck pressure symptoms, weight loss or anorexia. His past history included right partial thyroidectomy for a solitary nodule (colloid goitre) in 1978 and repair of abdominal aortic aneurysm in 1994. He had suffered myocardial infarction in 1995 and had an episode of acute coronary insufficiency in January 2003. His recent coronary angiograms showed an occluded left anterior descending artery and echocardiogram revealed good left ventricular function. He was a non-smoker and consumed alcohol in moderation. He had been taking warfarin, diltiazem MR, lisinopril, uniphyllin, glyceryl trinitrate tablets and buccal suscard.
On examination he had left sided goitre extending superiorly into the posterior triangle and inferiorly into the retrosternal space, with variable consistency. The trachea was deviated to the right and there was cervical lymphadenopathy on the left side. Systemic examination was unremarkable and fine needle aspiration of thyroid gland showed presence of HÇ¬rthle cells. Computerised tomographic (CT) scan with contrast enhancement (figure &) of the neck and thorax revealed large left sided thyroid goitre with significant mediastinal extension. It showed mixed attenuation with foci of calcification peripherally. There was a 3 cm complex mass on the left side of the neck, posterior to the carotid sheath structures and deep to the sternomastoid, indicative of lymph node metastases. Thyroid profile and routine blood investigations were unremarkable.
Based on the above findings radical surgery was planned. On exploration of the neck we confirmed left goitre with intrathoracic extension and enlarged lymph nodes under the sternocleidomastoid close to the jugulodigastric muscle and surrounding the carotid sheath. There was no remnant thyroid tissue seen on the right side following the previous thyroid surgery. Left hemithyroidectomy with modified neck dissection (lymphadenectomy, preserving all vessels and nerves) was performed. Macroscopic examination of the thyroid lobe showed a well defined solid pale brown mass approximately 8 cm in maximum dimension, surrounded by a narrow rim of preserved thyroid tissue. The lymph node specimen comprised of several nodules of partly necrotic tissue. Microscopic examination showed the thyroid lobe containing a HÇ¬rthle cell neoplasm, which was mostly encapsulated, with foci of capsular and vascular invasion. The two lymph nodes revealed metastatic HÇ¬rthle cell carcinoma. [pT3, N1a, Mx], (Figure &).
The patient had adjuvant therapy with oral radioiodine 131 (3060 MBq Sodium Iodine). He was put on a daily dose of 100 mcg of thyroxine. This was to be followed by a second dose of 5911 MBq of radioactive iodine six months from the time of the first dose.","[[79.0, 'year']]",M,2004,heart
13,515303-1,15318947,oa_comm/PMC000xxxxxx/PMC515303.xml,Dialysis Disequilibrium Syndrome: Brain death following hemodialysis for metabolic acidosis and acute renal failure ƒ?? A case report,"A 22-year-old homosexual male presented to hospital with progressive dyspnea, productive cough, generalized malaise and fever. He had a known history of intravenous cocaine abuse and recent serology in prior 3 months was negative for human immunodeficiency virus (HIV). Results of a physical examination showed signs of tachypnea, tachycardia, accessory muscle use and left lung base crackles. Tympanic temperature was 34.7¶øC. The remainder of the examination was unremarkable except for urethral meatus stenosis.
Initial laboratory investigations are presented in Table . Arterial blood gases showed pH of 6.95, PaCO2 10 mmHg, PaO2 109 mmHg, HCO3 2 mmol/L, and lactate 0.6 mmol/L consistent with high anion gap metabolic acidosis with respiratory compensation. Serum creatinine and blood urea nitrogen were 587 ×¬mol/L and 46.7 mmol/L, respectively. Toxicology and drug screen was negative. The metabolic acidosis was partially accounted for by acute renal failure with retained unmeasured anions and ketonemia. Urinalysis showed pyuria. Electrocardiogram (ECG) showed normal sinus rhythm.
Chest radiograph revealed right middle lobe and lingular patchy opacification. An abdomino-pelvic CT scan demonstrated moderate to severe bilateral hydronephrosis, bladder wall thickening with multiple diverticuli, and retroperitoneal streaking consistent with acute infection. A provisional diagnosis of severe sepsis was made with multiple potential foci of infection. The patient was given empiric ceftriaxone, metronidazole and vancomycin. Sputum specimen cultured heavy methicillin-sensitive Staphylococcus aureus, blood cultures were positive for S. aureus, Escherichia coli, and Group B Streptococcus. Urine cultured greater than 108 CFU/L of multiple gram positive and negative organisms.
The patient was admitted to the intensive care unit (ICU). The metabolic acidosis persisted (pH 7.00) a despite 100 mEq of 8.4% sodium bicarbonate bolus and infusion of three liters of normal bicarbonate solution (150 mEq of 8.4% sodium bicarbonate in 1000 mL D5W). The patient had a suprapubic bladder catheter inserted by angiography. However, due to concern the patient remained oliguric following 4 L crystalloid resuscitation, hemodialysis was organized. Hemodialysis parameters included: F160 membrane (surface area 1.5 m2 and KUf 50 mL/hr/mmHg), dialysate sodium 136 mmol/L, potassium 3 mmol/L, calcium 1.25 mmol/L, bicarbonate 40 mmol/L, and QD 500 mL/min, QB 250ƒ??300 mL/min via a 25 cm left femoral double-lumen Uldall catheter. The patient had 71.5 L of blood processed over four hours with no fluid removal. Although the patient was alert and appropriate (Glasgow Coma Scale 15) with tachycardia and stable normal range blood pressure before the initiation of dialysis, he was demonstrating an increased work of breathing and oxygen requirements suggestive of worsening sepsis syndrome. Approximately 2.5 hrs after start of dialysis the patient became rapidly unresponsive prompting intubation for airway protection. At completion of HD and over the subsequent 4 hours the patient's neurologic status deteriorated with evidence of loss of all brainstem reflexes. Head CT-scan is shown in Figure .
Repeat laboratory investigations immediately following hemodialysis revealed a pH 7.36, HCO3 19 mmol/L, sodium 132 mmol/L, potassium 1.8 mmol/L, and urea 13.7 mmol/L (urea-reduction-ratio was 71%) (Table ).
The patient rapidly progressed to refractory shock and multi-organ dysfunction Diagnosis of brain death was declared independently by an intensivist and a neurologist. At autopsy, the brain showed evidence of diffuse cerebral edema. Cardiac assessment showed left ventricular enlargement consistent with systemic hypertension likely as a result of chronic kidney disease. Both lungs showed patchy acute bronchopneumonia with edema and congestion. Both kidneys appeared grossly pyonephrotic with dilated, thickened ureters and suggested the presence of acute on chronic pyelonephritis. The meatal aperture was scarred and stenosed.","[[22.0, 'year']]",M,2004,heart
17,517503-1,15347427,oa_comm/PMC000xxxxxx/PMC517503.xml,Graft calcifications and dysfunction following liver transplantation,"A 65-year-old man of Asian origin underwent LT at our institution on June 2002, for decompensated Hepatitis B related cirrhosis. The patient did not have a history of abnormal calcium metabolism, or hyperparathyroidism. Upon listing his serum ionized calcium was 1.07 mmol/L. The donor was a previously healthy, 42-year-old male, who suffered intracranial bleeding following a motor vehicle crash. He did not suffer any period of hypoxia but he was hypotensive (SBP = 90 mm Hg) prior to procurement. His serum liver function tests were normal prior to harvesting (AST 32 U/L, ALT 40 U/L). The organ was procured by our institution's transplant team. During procurement the liver was found to be well perfused with no focal injuries and no macroscopic evidence of steatosis.
The recipient underwent an uncomplicated conventional LT without the use of a veno-venous bypass. There were no periods of hypoxia or severe hypotension during transplantation. The cold ischemic time of the graft was 8 hours while the warm ischemic time was 45 minutes. The graft reperfused well and no biopsies were taken. Intravenous methylprednisolone (500 mg) was administered intraoperatively, and postoperatively the patient received induction with Antithymocyte Globulin, which is the protocol followed at our institution. During transplantation the patient received a total of 4 units of packed red blood cells (PRBCs) and 6 units of fresh frozen plasma (FFP).
At the time of LT, the international normalization ratio (INR) was 1.53, while serum total bilirubin was 103 ×¬mol/L (Figure ). On postoperative day 2 the patient had a peak of his serum AST (3469 U/L) and at this point he had further biochemical evidence of primary graft dysfunction, with inability to normalize his INR (Figure ), and with progressive elevation of his total serum bilirubin (Figure ). Repeated ultrasonographic examination revealed a patent hepatic artery and portal vein, as well as patent hepatic veins. At this point, a liver biopsy demonstrated severe reperfusion injury with several apoptotic bodies, several dystrophic calcifications (Figure ), and no evidence of acute cellular rejection. His clinical status deteriorated, he developed multiorgan system failure and died 12 days after his transplantation. No septic focus was identified. Both kidneys harvested from the same donor did not present any signs of delayed graft function after transplantation.","[[65.0, 'year']]",M,2004,heart
