patient_id,patient_uid,PMID,file_path,title,patient,age,gender,pub_date,label
64020,7048021-1,32111168,oa_comm/PMC007xxxxxx/PMC7048021.xml,Leptospirosis in an asplenic patient -case report,"A 65-year-old female was admitted to the emergency room. The patient had a medical history of idiopathic thrombocytopenic purpura (ITP) diagnosed at the age of 18, refractory to steroid-based treatment. A splenectomy was performed, and she remained with normal platelet counts. She was diagnosed at 60 years-old with chronic myeloid leukaemia (CML), and received treatment with tyrosine kinase inhibitor (TKI)-Imatinib. The diagnosis was confirmed by bone marrow aspiration and fluorescent in situ hybridisation (FISH), in which 22% were negative cells and 78% positive cells for the Philadelphia chromosome. The qPCR for BCR-ABL/ABL was 40.22% (15,420.24 ABL copies, and 6202.4 BCR-ABL copies). On admission, she admitted to voluntarily had stopped the Imatinib treatment 6 months before due to a major depression, had fever and worsening eyesight (later diagnosed as acute uveitis) (Fig. ). She had no history of travelling to leptospirosis endemic areas, nor alcohol, drug or tobacco abuse, neither other medications intake. Nevertheless, she had close contact with her pet cat. She was admitted to the hospital with acute respiratory failure, bacteraemia and uveitis.
Laboratory tests showed leukocyte count of 144.6 Ç? 103/ml, hemoglobin 12.4 g/dl, platelets 763 Ç? 103/ml, glucose level of 116 mg/dl, and albumin level of 3.0 mg/dl. Liver function test showed malnourishment and low protein level. Renal function test showed high creatinine level indicating an acute kidney injury mainly associated with the inflammatory response, and electrolytes were within normal limits. Additionally, the levels of C-reactive protein and procalcitonin were moderately high (Supplementary Table ). Due to respiratory deterioration, a sputum culture was performed, and E. coli was isolated. In MÇ¸xico, at the time the patient was treated, there was an outbreak of influenza, reason why a diagnostic qPCR for the influenza virus was performed; the result was negative. The chest X-Ray revealed multiple pneumonia foci (Fig. ). She was started on empirical broad antibiotic regimen. Blood and urine cultures collected on admission showed no microorganisms grown from conventional medium or seen on Gram, Ziehl-Nielsen, and Giemsa stains. The blood cultures in the BacT/ALERT¶© FA medium (bioMÇ¸rieux, Durham NC), after 2 days of incubation at 34 ¶øC, were positive. Unstained spirochaete-like microorganisms were observed by dark-field microscopy. Due to clinical and microbiological finding, the antimicrobial treatment was changed to penicillin 20 million UI/ IV, plus doxycycline 100 mg twice a day. Subsequently, two blood samples were tested by Microagglutination test (MAT) separated from each other by 10 days (Supplementary Methodology Document). Differential diagnosis were performed, and negative results were reported. After the successful treatment, the CML treatment was resumed with a second-generation TKI (Dasatinib). A year later, the FISH analysis showed 35 negative cells and 65 positive cells for the Philadelphia chromosome. The aspiration of bone marrow showed an adequate maturation, compatible with CML in chronic phase.
Microagglutination test (MAT) was performed as previously described by the Pan American Health Organization []. The patientƒ??s sera were diluted to 1/50 for a screening test and 50 ×¬l of live cultures of 4 to 7 days in EMJH medium of twelve L. interrogans serovars were used as antigens (Autumnalis, Bataviae, Bratislava, Canicola, Celledoni, Grippotyphosa, Hardjoprajitno, Icterohaemorrhagiae, Pomona, Pyrogenes, Tarassovi, Wolffi and Mini) (Supplementary Table ). Each serovar was added into a column of a 96-well flat end microtitre plate (Nunc, Maryland, USA); a negative control was included for each serovar. The plate was gently stirred and incubated 1 hour at room temperature. Reading was performed in dark-field microscopy (Carl Zeiss, Germany). The patientƒ??s sera were serially diluted from 1/25 to 1/1600, and the microagglutination was observed for each serovar. The final titre represents the maximum dilution in which the agglutination grade two was noted.
From the patientƒ??s blood sample, three drops were seeded into EMJH liquid medium and maintained at 30 ¶øC. Cultures were periodically observed in dark-field microscopy to spot spirochaetal forms and maintained for 6 months before being considered negative cultures. In parallel, the patientƒ??s blood sample was inoculated to a Syrian golden hamster (Mesocricetus auratus) for bacterial isolation [] (Supplementary Methodology Document and Supplementary Table ).
DNA was extracted from the patientƒ??s blood samples and the hamsterƒ??s tissues with the DNeasy Blood &Tissue Kit (QIAGEN, Cal, USA), according to the manufacturerƒ??s instructions and suspended in 50 ×¬L of nuclease-free water. DNA was quantified using an Epoch microplate spectrophotometer (Biotech) and stored at 4 ¶øC.
The Leptospira genus-specific PCR based on the 23S rDNA was used to amplify a 482 bp fragment []. A second PCR was performed to identify only pathogenic strains based on the amplification of the insertion sequence IS1500 of L. interrogans (sensu lato) [] (Supplementary Methodology Document). The electrophoresis of the amplified products were stained with ethidium bromide on 1.6% agarose gels and visualised. Further genus identification was performed based on sequencing of the 16S rRNA gene, using the primers 27f (5ƒ?ý-AGAGTTTGATCMTGGCTCAG-3ƒ?ý) and 1492r (5ƒ?ý-TACGCYTACCTTGTTACGACTT-3ƒ?ý) with DNA extracted from the first blood sample as template []. A PCR product of 1432 bp was amplified, purified, and DNA was sequenced in both directions. Nucleotide sequence was determined with Taq FS Dye Terminator Cycle Sequencing Fluorescence-Based Sequencing, and analysed on an Applied Biosystems 3730 DNA sequencing system (Foster City, CA, USA). The sequence was registered in Genbank under the accession number MN545905. It has 100% homology with Leptospira interrogans strains (CP011410.1, AE016823.1, AE010300.2, and CP018146.1) and variable homology with reference sequences (Supplementary Methodology Document and Supplementary Table ).
In summary, the results support the diagnosis of leptospirosis; abundant spirochaetal forms, at least 106
Leptospires/mL were observed in dark field microscopy, The MAT results (Supplementary Table ) indicated the serovar Bratislava as the most probable causing serovar because the patientƒ??s serum reacted with Bratislava (Jez Bratislava) in titres of 1/320. This titre was the highest in the first sample and stayed in a steady-state in the second sample. There was no other serovar with titres at this level. Titres to Serovars Bataviae (Van Tienen); Canicola (Hond Utech IV); Grippotyphosa (Moska V); Hardjo (Hardjoprajitno), and Pomona (Pomona) were lower than 1/80 in both samples, and those for Pyrogenes (Salinem) fell from 1/160 to 1/80 in the second sample. During the Leptospira isolation attempt, its survival was sustained for about a month in the EMJH medium, but it did not flourish. The PCRs based on the23S rDNA and the IS1500 identified the presence of the bacteria DNA in the patientƒ??s blood samples, in the hamster tissues (Supplementary Table ), and the Leptospira genus was identified by the 16S based sequencing.","[[65.0, 'year']]",F,2/28/2020,liver
64022,7048027-1,32111175,oa_comm/PMC007xxxxxx/PMC7048027.xml,ƒ??You only live twiceƒ?: multidisciplinary management of catastrophic case in placenta Accreta Spectrum-a case report,"We report the case of a 22-year-old pregnant women, G2P1, diagnosed with placenta accreta spectrum (PAS) and referred to our institution at 31 weeks of gestation for further care and management. Earlier, at 25 weeks of gestation, the patient reported vaginal spotting. An ultrasound performed by her primary obstetrician was suggestive of a placenta percreta. At 30 weeks, she experienced a preterm premature rupture of membranes and moderate vaginal bleeding requiring her admission in a primary care hospital. During her stay, she received tocolytics, antibiotics and steroids. Strict bed rest was prescribed but no thrombosis prophylaxis was administered given her history of vaginal bleeding that lasted one week. Upon confirming the diagnosis of placenta previa with accreta spectrum on a pelvic MRI, the patient was referred to our tertiary care center to schedule her delivery.
Eight months earlier, she underwent a cesarean section due to a protracted labor. Postoperatively, she received no prophylactic anticoagulation. Besides, she was taking oral contraceptives for three months because of a persistent vaginal bleeding; she stopped them three months before pregnancy. The patient reported no relevant past medical or surgical events. Her father died at the age of 42 of an ischemic stroke and two uncles had histories of non-specific thromboembolic events.
On admission, the patient was afebrile, hemodynamically stable and did not complain of pelvic pain. She noted only light to moderate persistent vaginal bleeding. Urgent ultrasound showed a viable fetus with appropriate biometrical parameters and no amniotic fluid. Fetal cardiotocography revealed regular uterine contractions. She underwent urgent delivery by cesarean section and hysterectomy under general anesthesia according to our specially developed technique [, ]. The placenta was previa, anteriorly located and slightly lateralized to the left and reached the uterine serosa without perforating it. The placenta was bulging under a thin uterine serosa with a lot of neo-vascularization at this level.
The total estimated blood loss during surgery was 1800 ml. This large amount of intraoperative bleeding was essentially from the vagina, which was unfortunately uncontrollable before removing the uterus completely. The anesthesiologist in charge had to transfuse the patient with allogenic red blood cells (RBC; 7 units), fresh-frozen plasma (FFP; 6 units) and platelets (1 unit) to maintain her hemodynamic stability. Since more than four RBC units were transfused in less than one hour, the transfusion was considered massive and 1:1 ratio of FFP to RBC scheme was used. At the end of surgery and transfusion, an evaluation of complete blood count (CBC) revealed a hematocrit level of 32% and hemoglobin level of 10.8 g/dl. The patient was also normothermic and hemodynamically stable. She was waked up from anesthesia and was transferred to ICU for postoperative surveillance. At ICU admission, she was hemodynamically stable with normal neurologic examination.
Two hours later, the patient became cyanotic and went into cardio pulmonary arrest. Cardiac monitoring showed pulseless ventricular tachycardia. Arterial blood gases showed hypocapnia (PaCO2 of 30 mmHg) and hypoxia (PaO2 of 61 mmHg). Characteristic S1Q3 wave detected on electrocardiography was associated with hypoxia and hypocania, which were highly suggestive of pulmonary embolism (PE). She was intubated and received 40 min of cardiopulmonary resuscitation. A transthoracic echocardiogram done in ICU showed a thrombus in the right ventricle. Urgent pulmonary angiogram after hemodynamic stabilization confirmed the diagnosis of bilateral massive PE (Fig. ).
So the patient underwent an urgent thoracotomy and an extracorporeal circulation was used. During surgery, a simultaneous transesophageal cardiac ultrasound was done showing a dilated right ventricle containing clots. A pulmonary artery thrombectomy was performed and multiple clots were retrieved from the pulmonary artery (Fig. ).
Once the situation was stabilized, an inferior vena cava filter was placed via an abdominal incision and external iliac vein catheterization. After weaning from extracorporeal circulation, an intraoperative transesophageal cardiac ultrasound revealed the presence of a new free-floating thrombus in the right atrium and right ventricle (). A second extracorporeal circulation using new cannulation of the large vessels was initiated and a second embolectomy was performed. The patient was transferred to the cardiac surgery care unit (CSU) for surveillance. While at CSU, she was placed on therapeutic intravenous heparin for anticoagulation and had compressive pneumatic stockings in place at all times.
Two days later, the patient experienced a major hemoperitoneum with distended abdomen and tachycardia due to massive anticoagulation that necessitated a second laparotomy to achieve hemostasis. Only blood clots were found in the peritoneal cavity without active source of bleeding. All vascular pedicles were controlled and the vaginal cuff was re-sutured. Intraoperative evaluation of CBC revealed a hematocrit level of 26% and hemoglobin level of 8.7 g/dl. Intraoperative allogeneic RBC (4 units) and FFP (5 units) were transfused. The rest of her post-operative course was uneventful.
The patient was discharged on postoperative day 13. She received acenocoumarol per os for a lifetime anticoagulation. A follow-up was organized with a hematologist to perform a full thromboembolic disease work-up. A panel of tests for hypercoagulability was performed and showed: protein S deficiency, presence of circulating lupus anticoagulant, heterozygous methylenetetrahydrofolate reductase (MTHFR) mutation and genotypes of plasminogen activator inhibitor (PAI), human platelet antigen (HPA), angiotensin converting enzyme (ACE), and apolipiprotein E (Apo E) with a moderate risk for thrombosis.
The pathologic report confirmed the diagnosis of abnormally invasive placenta type percreta (grade 3a, according to FIGO classification): hysterectomy specimen showing villous tissue reaching the uterine serosa and in multiple places breaching the serosa and invading the extrauterine adipose tissue with a fibrous reaction at this level.","[[22.0, 'year']]",F,2/28/2020,liver
64027,7048907-1,32128265,oa_comm/PMC007xxxxxx/PMC7048907.xml,Hepatocellular Glycogen Accumulation in the Setting of Poorly Controlled Type 1 Diabetes Mellitus: Case Report and Review of the Literature,"A 23-year-old woman with type 1 DM, GERD, amenorrhea (resolved) and more recently irregular menstrual periods whom presented to the emergency department with complaints of right-sided abdominal pain of 14 days duration. Pain was described as sharp in nature, intermittent, worsened by eating, and without any relieving factors. It was associated with nausea and had been progressively increasing in intensity and frequency of occurrence. She was diagnosed with type 1 DM 11 years prior, which was poorly controlled, with a mean HbA1c of 12.05% over a 2-year period. She had been admitted multiple times for DKA.
At presentation, the patient appeared well developed for her age except for a short stature and being underweight (BMI 17.54). She was tachycardic (HR 117 bpm) and tender in the right upper and lower quadrants of the abdomen without guarding or rebound tenderness. The liver was palpable 3 inches below the right costal margin. Laboratory results revealed mild DKA as evidenced by the elevated blood sugar (344 mg/dl), anion gap acidosis of 17, HCO3 of 18 mMol/L, venous pH 7.31, serum ketones < 1 : 4 dilution, and trace urine ketones. Her blood glucose reduced to 76 mg/dl after two liters of intravenous fluids. Her home insulin regimen was promptly resumed, and she did not require an insulin infusion. AST (511 mg/dl), ALT (366 mg/dl), and ALP (304 mg/dl) were elevated. Lactic acid was elevated at 8.0 mg/dL. Total bilirubin (0.4 mg/dl), albumin (4 mg/dl), INR (0.9), and platelet count (248 cells/microliter) were within normal limits. HbA1c on presentation was 11.5%. Other laboratory values including amylase and lipase were within normal limits.
Commuted tomography (CT) of the abdomen and pelvis with contrast (Figures and ) showed an enlarged liver, 26 cm in full length with mass effect on adjacent structures including the inferior vena cava, stomach, duodenum, pancreas, and hepatic flexure of the colon. Abdominal ultrasound with Doppler was negative for hepatic vein thrombosis. Of note, the patient was not on any hepatotoxic medications. Laboratory workup for causes of elevated liver enzymes including: infective workup (EBV, CMV, Hepatitis A, B, and C), iron studies (normal ferritin, decreased total iron, and iron saturation), ceruloplasmin level, serum alpha-fetoprotein, and thyroid function were all within normal limits. Celiac disease had been ruled out previously in the outpatient setting with negative tissue transglutaminase antibodies and endomysial antibody. Autoimmune workup including antinuclear antibody (ANA) titer, antismooth muscle antibody, antimitochondrial antibody, and liver/kidney microsome were all negative or within normal limits. A transthoracic echocardiogram showed normal right and left ventricular functions, with a left ventricular ejection fraction of 55ƒ??60%.
CT-guided biopsy of the liver was done due to diagnostic uncertainty and increasing AST/ALT (). Liver biopsy showed pale and swollen hepatocytes () with heavy glycogen staining seen on Periodic Acid Schiff (PAS) stain () which was absent after digestion with diastases (). Numerous intranuclear glycogen inclusions, as well as some patchy steatosis, were noted. There were no signs of fibrosis or increased iron deposition.
A diagnosis of glycogenic hepatopathy was made. She was managed symptomatically for pain and strict glycemic control was implemented. Symptoms of abdominal pain improved, and lactic acid returned to normal (1.7 mg/dl) on hospital day 3 with adequate fluid resuscitation. The patient was discharged home on hospital day 7 () with a more aggressive insulin regimen, and follow-ups with her primary care physician (PCP) and endocrinologist were scheduled. At discharge (day 7), AST, ALT, and ALP were 237 mg/dl, 271 mg/dl, and 200 mg/dl, respectively. Unfortunately, the patient was not compliant with follow-up and was not seen for another year at which time her HbA1C was 12.6%. Liver enzymes however were within normal limits with ALT, AST, and ALP at 20 mg/dl, 35 mg/dl, and 54 mg/dl, respectively. Repeat contrasted CT abdomen twelve months later showed persistent hepatomegaly measuring 27.8 Ç? 21.4 Ç? 15.5 cm (Figures and ). Liver dimensions were similar to the CT findings at initial presentation. The importance of strict glycemic control was reemphasized, and she was rescheduled for follow-up with her primary care physician and endocrinologist.","[[23.0, 'year']]",F,2020,liver
64032,7049220-1,32111177,oa_comm/PMC007xxxxxx/PMC7049220.xml,Effect of intraocular anti-VEGF on cystoid macular edema associated with Henoch-Schonlein purpura-a case report,"A 21-year-old man presented a bilateral, painless, and blurred vision for 5 weeks. Before ocular symptoms, he had got a mild cold and cough for several days. Two years ago, he was diagnosed with HSP, manifesting symptoms of hematuria and purpura. His clinical manifestations were resolved with the treatment of intravenous methylprednisolone followed by oral prednisolone. He had only once recurrence of symptoms after an attack of influenza during the 2 years.
Five weeks ago, he experienced blurred vision in both eyes, especially in the left eye but he didnƒ??t pay much attention. At that time, he was taking 2.5 mg oral prednisolone per day and he ceased prednisolone 1 week later. At present, the patient had no symptoms of active HSP symptoms and had normal blood pressure. He denied a history of hypertension and trauma. There were no abnormal findings upon the total blood cell count, coagulation profile, and the function of the liver and kidney.
On examination, his best-corrected visual acuity (BCVA) was 6/12 on the right eye and 6/48 on the left, with a relative afferent pupillary defect in the left eye. The anterior chamber was quiet. Fundus examination and retinal fluorescein angiography(FA) revealed diffuse, tortuous, and dilated retinal vein with scattered round-like retinal hemorrhages (Fig. a-c). The optical coherence tomography (OCT) showed cystoid macular edema (ME) in both eyes (Fig. d).
The patient began to take intravenous dexamethasone 10 mg per day and experienced a significant improvement on the following day. Seven days later, his BCVA was 6/6 on the right eye and 6/12 on the left with a significant reduction in macular edema, which was demonstrated by the OCT images (Fig. a).
Unfortunately, ME of the left eye reoccurred 1 week after he switched to oral prednisoneME (Fig. b), and the vision decreased to 6/60 again on the left eye and remained 6/6 on the right eye. He received 3 + PRN of intravitreal aflibercept injection in both eyes, with three injections in the right eye and four injections in the left eye. His VA improved to 6/6 on the right eye and 6/7.5 on the left with the regression of retinal hemorrhages (Fig. a) and then faded awayfrom macular edema (Fig. b) after 6 months follow-up (Fig. ).","[[21.0, 'year']]",M,2/28/2020,liver
64034,7049296-1,32114637,oa_comm/PMC007xxxxxx/PMC7049296.xml,Opposite changes in blood pressure and pulse rate in two patients with distigmine and rivastigmine intoxication,"A 77-year-old bedridden Japanese woman with a body mass index (BMI) of 19.8 kg/m2 receiving 5 mg of distigmine daily for a neurogenic bladder was transferred to the emergency department of our hospital because of impaired consciousness. On admission, she was disoriented with a Glasgow coma scale of 10 (E4V2M4), and her vital signs were BP 69/40 mmHg, PR 60 beats/min, and oxygen saturation 79% with oxygen therapy via a nonrebreather face mask at 10 L/min. Physical examination revealed pupil miosis, excess salivation, urinary incontinence, and watery diarrhea, but no obvious signs of dehydration. A blood gas analysis suggested acute hypercapnic respiratory failure (arterial carbon dioxide, 51.8 mmHg; arterial oxygen tension, 41.5 mmHg). Laboratory data showed mild leukocytosis and serum cholinesterase (ChE) of 8 IU/L. Other blood tests, including kidney function, liver function including serum albumin, C-reactive protein, and blood glucose, were within normal ranges. Her head computed tomography (CT) scan, electrocardiography, and chest X-ray were unremarkable. Her chest CT scan revealed slight centrilobular nodules with a large amount of intrabronchial secretion. She was diagnosed with distigmine-induced cholinergic crisis followed by acute hypercapnic respiratory failure because of alveolar hypoventilation due to bronchorrhea.
After admission, distigmine was discontinued, and she received supplemental oxygen therapy and ceftriaxone treatment for a possible concurrent pneumonia. Altered mental status, pupil miosis, respiratory failure, excess salivation, urinary incontinence, and watery diarrhea were gradually resolved in 5 days with a concomitant increase of serum ChE (Table (A)).","[[77.0, 'year']]",F,2/29/2020,liver
64035,7049296-2,32114637,oa_comm/PMC007xxxxxx/PMC7049296.xml,Opposite changes in blood pressure and pulse rate in two patients with distigmine and rivastigmine intoxication,"A 91-year-old Japanese woman with Alzheimerƒ??s disease was taken to her primary care physician for a headache and lightheadedness. The patient had normal BMI, and her nutritional status seemed to correspond to the chronological age. Her vital signs were BP 202/86 mmHg, PR 83 beats/min, and oxygen saturation 98% in room air. She was referred to our department for further evaluation. On admission to our hospital, physical examination revealed pupil miosis but no findings of lacrimation, urination, or bronchorrhea. The emergency physician noticed 9 rivastigmine patches (4 patches of a 9-mg/day formula and 5 of a 13.5-mg/day formula) attached to her both knees. She said that she mistakenly used these patches instead of topical analgesia. Laboratory data showed mild leukocytosis and a serum ChE of 22 IU/L. Other blood tests, including kidney function, liver function, C-reactive protein, and blood glucose, were within normal ranges. Her head CT scan, electrocardiography, and chest X-ray were unremarkable. She was suspected to be in cholinergic crisis caused by rivastigmine overdose and was admitted for close observation without rivastigmine use. The day after her admission, her symptoms, headache, lightheadedness, and miosis were almost resolved with a concomitant increase of serum ChE (Table (B)). On day 7, her serum ChE levels returned to baseline at 236 IU/L. Consequently, she was diagnosed with rivastigmine-induced cholinergic crisis.","[[91.0, 'year']]",F,2/29/2020,liver
